{
  "interface_version": 1,
  "invocation": {
    "caller": "user",
    "harness": "claude-code",
    "mode": "direct",
    "session_id": "session-example-1"
  },
  "plugin_version": "0.1.2",
  "reason": "several candidates, listed for the owner and never picked (scope: docs/scope/2026-09-20-widget.md, docs/widget-scope.md). Ask which one, then start a new run and record his pick with `choose` before harvest",
  "report_only": false,
  "run_dir": "/tmp/station-runs/run-0001",
  "run_id": "run-0001",
  "selection": {
    "scope": {
      "candidates": [
        {
          "home": "repo-scope",
          "path": "/tmp/widget-workspace/docs/scope/2026-09-20-widget.md",
          "tier": 1
        }
      ],
      "hunt": "scope",
      "name": null,
      "outcome": "one",
      "searched": [
        {
          "found": [
            "/tmp/widget-workspace/docs/scope/2026-09-20-widget.md"
          ],
          "given": true,
          "globs": [
            "docs/scope/{name}.md",
            "docs/scope/[0-9][0-9][0-9][0-9]-[0-9][0-9]-[0-9][0-9]-{name}.md"
          ],
          "home": "repo-scope",
          "root": "workspace",
          "tier": 1
        },
        {
          "found": [],
          "given": true,
          "globs": [
            "docs/{name}-scope.md"
          ],
          "home": "repo-flat",
          "root": "workspace",
          "tier": 1
        }
      ]
    }
  },
  "station": "blueprint-v2",
  "station_result": {
    "architecture_doc": null,
    "assumptions": 0,
    "collapsed_gate": null,
    "doc": null,
    "doc_action": "none",
    "feature": "widget",
    "needs_build_doc": null,
    "new_slices": [],
    "open_questions": 0,
    "questions_asked": 0,
    "readback": "BLUEPRINT: widget\nStopped: selection-several\nseveral candidates, listed for the owner and never picked (scope: docs/scope/2026-09-20-widget.md, docs/widget-scope.md). Ask which one, then start a new run and record his pick with `choose` before harvest",
    "scope_doc": null,
    "slice_names": [],
    "slices": 0
  },
  "status": "stopped",
  "stop_tag": "selection-several",
  "writes": [
    {
      "kind": "run_artifact",
      "path": "/tmp/station-runs/run-0001/checkpoint.json",
      "sha256_after": null,
      "sha256_before": null
    },
    {
      "kind": "run_artifact",
      "path": "/tmp/station-runs/run-0001/input.json",
      "sha256_after": "bbbbbbbbbbbbbbbbbbbbbbbbbbbbbbbbbbbbbbbbbbbbbbbbbbbbbbbbbbbbbbbb",
      "sha256_before": null
    },
    {
      "kind": "run_artifact",
      "path": "/tmp/station-runs/run-0001/selection-architecture.json",
      "sha256_after": "bbbbbbbbbbbbbbbbbbbbbbbbbbbbbbbbbbbbbbbbbbbbbbbbbbbbbbbbbbbbbbbb",
      "sha256_before": null
    },
    {
      "kind": "run_artifact",
      "path": "/tmp/station-runs/run-0001/selection-build.json",
      "sha256_after": "bbbbbbbbbbbbbbbbbbbbbbbbbbbbbbbbbbbbbbbbbbbbbbbbbbbbbbbbbbbbbbbb",
      "sha256_before": null
    },
    {
      "kind": "run_artifact",
      "path": "/tmp/station-runs/run-0001/selection-scope.json",
      "sha256_after": "bbbbbbbbbbbbbbbbbbbbbbbbbbbbbbbbbbbbbbbbbbbbbbbbbbbbbbbbbbbbbbbb",
      "sha256_before": null
    },
    {
      "kind": "run_artifact",
      "path": "/tmp/station-runs/run-0001/result.json",
      "sha256_after": null,
      "sha256_before": null
    }
  ],
  "wrote_nothing": true
}
